Index,Column,Values,Coverage,Example,Description,Source,SourceLink,Definition,DefinitionLink
1,title,4727,100%,Janus,The official title of the language,,,name.grammar,https://github.com/breck7/pldb/blob/main/database/grammar/name.grammar#L2
2,appeared,4367,92%,2014,What year was the language publicly released and/or announced?,,,history.grammar,https://github.com/breck7/pldb/blob/main/database/grammar/history.grammar#L12
3,type,4727,100%,pl,Which category in PLDB's subjective ontology does this entity fit into.,,,type.grammar,https://github.com/breck7/pldb/blob/main/database/grammar/type.grammar#L4
4,pldbId,4727,100%,05ab1e,computed,,,A computed value,
5,rank,4727,100%,0,computed,,,A computed value,
6,languageRank,4113,87%,0,computed,,,A computed value,
7,factCount,4727,100%,6,computed,,,A computed value,
8,lastActivity,4377,93%,2022,computed,,,A computed value,
9,exampleCount,4727,100%,0,computed,,,A computed value,
10,bookCount,4727,100%,0,computed,,,A computed value,
11,paperCount,4727,100%,0,computed,,,A computed value,
12,numberOfUsers,4727,100%,0,computed,,,A computed value,
13,numberOfJobs,4727,100%,0,computed,,,A computed value,
14,githubBigQuery.repos,421,9%,1,How many repos for this language are listed in Google's BigQuery Public GitHub Dataset snapshot.,,,githubBigQuery.grammar,https://github.com/breck7/pldb/blob/main/database/grammar/githubBigQuery.grammar#L13
15,creators,873,18%,Niklaus Wirth,"Name(s) of the original creators of the language delimited by "" and """,,,history.grammar,https://github.com/breck7/pldb/blob/main/database/grammar/history.grammar#L3
16,githubRepo,782,17%,https://github.com/breck7/note,URL of the official GitHub repo for the project if it hosted there.,github.com,https://github.com,githubRepo.grammar,https://github.com/breck7/pldb/blob/main/database/grammar/githubRepo.grammar#L1
17,website,1400,30%,http://berkin.me/rant,URL of the official homepage for the language project.,,,website.grammar,https://github.com/breck7/pldb/blob/main/database/grammar/website.grammar#L1
18,wikipedia,1903,40%,https://en.wikipedia.org/wiki/Apache_Velocity,"URL of the entity on Wikipedia, if and only if it has a page dedicated to it.",wikipedia.org,https://wikipedia.org,wikipedia.grammar,https://github.com/breck7/pldb/blob/main/database/grammar/wikipedia.grammar#L2
19,hopl,4727,100%,1664117682000,The matching language on Diarmuid Pigott's Online Historical Encyclopaedia of Programming Languages site (https://hopl.info/),hopl.info,https://hopl.info,hopl.grammar,https://github.com/breck7/pldb/blob/main/database/grammar/hopl.grammar#L1
20,centralPackageRepositoryCount,3032,64%,0,"If you've searched for a CPM for this language and can't find one, set 0 as the count.",,,packages.grammar,https://github.com/breck7/pldb/blob/main/database/grammar/packages.grammar#L6
21,reference,2019,43%,https://github.com/andrejbauer/plzoo,"A link to more info about this entity. You can add raw links and then auto ""upgrade"" them using some of the importer code.",,,reference.grammar,https://github.com/breck7/pldb/blob/main/database/grammar/reference.grammar#L1
22,hoplId,1815,38%,1681,computed,,,A computed value,
23,wikipedia.dailyPageViews,1698,36%,-1,How many page views per day does this Wikipedia page get? Useful as a signal for rankings. Available via WP api.,,,wikipedia.grammar,https://github.com/breck7/pldb/blob/main/database/grammar/wikipedia.grammar#L32
24,wikipedia.backlinksCount,1647,35%,9,How many pages on WP link to this page?,,,wikipedia.grammar,https://github.com/breck7/pldb/blob/main/database/grammar/wikipedia.grammar#L37
25,wikipedia.pageId,1625,34%,4840,Waht is the internal ID for this entity on WP?,,,wikipedia.grammar,https://github.com/breck7/pldb/blob/main/database/grammar/wikipedia.grammar#L47
26,wikipedia.summary,1625,34%,"Blitz BASIC refers to the programming language dialect that was interpreted by the first Blitz compilers, devised by New Zealand-based developer Mark Sibly. Being derived from BASIC, Blitz syntax was designed to be easy to pick up for beginners first learning to program.  The languages are game-programming oriented but are often found general-purpose enough to be used for most types of application. The Blitz language evolved as new products were released, with recent incarnations offering support for more advanced programming techniques such as object-orientation and multi-threading.  This led to the languages losing their BASIC moniker in later years.",What is the text summary of the language from the Wikipedia page?,,,wikipedia.grammar,https://github.com/breck7/pldb/blob/main/database/grammar/wikipedia.grammar#L18
27,wikipedia.appeared,1561,33%,1980,When does Wikipedia claim this entity first appeared?,,,wikipedia.grammar,https://github.com/breck7/pldb/blob/main/database/grammar/wikipedia.grammar#L27
28,wikipedia.created,1395,30%,2004,When was the *Wikipedia page* for this entity created?,,,wikipedia.grammar,https://github.com/breck7/pldb/blob/main/database/grammar/wikipedia.grammar#L22
29,wikipedia.revisionCount,1297,27%,1,How many revisions does this page have?,,,wikipedia.grammar,https://github.com/breck7/pldb/blob/main/database/grammar/wikipedia.grammar#L42
30,wikipedia.related,1286,27%,java,What languages does Wikipedia have as related?,,,wikipedia.grammar,https://github.com/breck7/pldb/blob/main/database/grammar/wikipedia.grammar#L14
31,fileType,1269,27%,text,What is the file encoding for programs in this language?,,,type.grammar,https://github.com/breck7/pldb/blob/main/database/grammar/type.grammar#L14
32,isbndb,1092,23%,0,Books about this language from ISBNdb.,isbndb.com,https://isbndb.com,isbndb.grammar,https://github.com/breck7/pldb/blob/main/database/grammar/isbndb.grammar#L1
33,description,893,19%,A nsfw esolang.,Description of the repo on GitHub.,,,githubRepo.grammar,https://github.com/breck7/pldb/blob/main/database/grammar/githubRepo.grammar#L41
34,domainName,865,18%,wiki.xxiivv.com,If the project website is on its own domain.,,,website.grammar,https://github.com/breck7/pldb/blob/main/database/grammar/website.grammar#L12
35,semanticScholar,760,16%,0,Papers about this language from Semantic Scholar.,semanticscholar.org,https://semanticscholar.org,semanticScholar.grammar,https://github.com/breck7/pldb/blob/main/database/grammar/semanticScholar.grammar#L1
36,githubRepo.updated,714,15%,2022,What year was the last commit made?,,,githubRepo.grammar,https://github.com/breck7/pldb/blob/main/database/grammar/githubRepo.grammar#L14
37,githubRepo.created,714,15%,2015,When was the *Github repo* for this entity created?,,,githubRepo.grammar,https://github.com/breck7/pldb/blob/main/database/grammar/githubRepo.grammar#L10
38,githubRepo.subscribers,714,15%,1,How many subscribers to the repo?,,,githubRepo.grammar,https://github.com/breck7/pldb/blob/main/database/grammar/githubRepo.grammar#L25
39,githubRepo.stars,714,15%,0,How many stars of the repo?,,,githubRepo.grammar,https://github.com/breck7/pldb/blob/main/database/grammar/githubRepo.grammar#L33
40,githubRepo.forks,712,15%,0,How many forks of the repo?,,,githubRepo.grammar,https://github.com/breck7/pldb/blob/main/database/grammar/githubRepo.grammar#L29
41,githubRepo.firstCommit,711,15%,2019,What year the first commit made in this git repo?,,,githubRepo.grammar,https://github.com/breck7/pldb/blob/main/database/grammar/githubRepo.grammar#L18
42,githubRepo.issues,709,15%,0,How many isses on the repo?,,,githubRepo.grammar,https://github.com/breck7/pldb/blob/main/database/grammar/githubRepo.grammar#L37
43,githubRepo.description,703,15%,(Obsolete) Archive of Rant 3.x.,Description of the repo on GitHub.,,,githubRepo.grammar,https://github.com/breck7/pldb/blob/main/database/grammar/githubRepo.grammar#L41
44,originCommunity,689,15%,Microsoft,In what community(ies) did the language first originate?,,,originCommunity.grammar,https://github.com/breck7/pldb/blob/main/database/grammar/originCommunity.grammar#L1
45,country,638,13%,United States,What country was the language first developed in?,,,history.grammar,https://github.com/breck7/pldb/blob/main/database/grammar/history.grammar#L45
46,domainName.registered,620,13%,2016,When was this domain first registered?,,,website.grammar,https://github.com/breck7/pldb/blob/main/database/grammar/website.grammar#L20
47,features.hasComments,616,13%,true,,,,features.grammar,https://github.com/breck7/pldb/blob/main/database/grammar/features.grammar#L153
48,isOpenSource,574,12%,true,Is it an open source project?,,,history.grammar,https://github.com/breck7/pldb/blob/main/database/grammar/history.grammar#L53
49,features.hasSemanticIndentation,573,12%,false,,,,features.grammar,https://github.com/breck7/pldb/blob/main/database/grammar/features.grammar#L366
50,features.hasLineComments,538,11%,true,I define a line comment as a character(s) that starts a comment that cannot be stopped except by a line break character or end of file character.,,,features.grammar,https://github.com/breck7/pldb/blob/main/database/grammar/features.grammar#L155
51,githubLanguage,529,11%,X PixMap,GitHub has a set of supported languages as defined here: https://raw.githubusercontent.com/github/linguist/master/lib/linguist/languages.yml,github.com,https://github.com,githubLanguage.grammar,https://github.com/breck7/pldb/blob/main/database/grammar/githubLanguage.grammar#L1
52,githubLanguage.tm_scope,520,11%,none,"The TextMate scope that represents this programming language. This should match one of the scopes listed in the grammars.yml file. Use ""none"" if there is no grammar for this language.",,,githubLanguage.grammar,https://github.com/breck7/pldb/blob/main/database/grammar/githubLanguage.grammar#L30
53,githubLanguage.ace_mode,520,11%,text,"A String name of the Ace Mode used for highlighting whenever a file is edited. This must match one of the filenames in http://git.io/3XO_Cg. Use ""text"" if a mode does not exist.",,,githubLanguage.grammar,https://github.com/breck7/pldb/blob/main/database/grammar/githubLanguage.grammar#L18
54,githubLanguage.type,520,11%,programming,"Either data, programming, markup, prose, or nil.",,,githubLanguage.grammar,https://github.com/breck7/pldb/blob/main/database/grammar/githubLanguage.grammar#L50
55,githubLanguage.fileExtensions,519,11%,bf,"An Array of associated extensions (the first one is considered the primary extension, the others should be listed alphabetically).",,,githubLanguage.grammar,https://github.com/breck7/pldb/blob/main/database/grammar/githubLanguage.grammar#L14
56,numberOfRepos,491,10%,0,computed,,,A computed value,
57,githubLanguage.repos,491,10%,0,How many repos for this language does GitHub report?,,,githubLanguage.grammar,https://github.com/breck7/pldb/blob/main/database/grammar/githubLanguage.grammar#L75
58,lineCommentToken,467,10%,//,Defined as a token that can be placed anywhere on a line and starts a comment that cannot be stopped except by a line break character or end of file.,,,featureTokens.grammar,https://github.com/breck7/pldb/blob/main/database/grammar/featureTokens.grammar#L16
59,domainName.awisRank.2022,446,9%,10763,,,,primitives.grammar,https://github.com/breck7/pldb/blob/main/database/grammar/primitives.grammar#L83
60,githubLanguage.trendingProjectsCount,445,9%,0,How many trending repos for this language does GitHub report?,,,githubLanguage.grammar,https://github.com/breck7/pldb/blob/main/database/grammar/githubLanguage.grammar#L69
61,leachim6.filepath,428,9%,#/05AB1E,,,,leachim6.grammar,https://github.com/breck7/pldb/blob/main/database/grammar/leachim6.grammar#L7
62,leachim6,428,9%,05AB1E,A link to this language in leachim6's hello-world project.,github.com/leachim6/hello-world,https://github.com/leachim6/hello-world,leachim6.grammar,https://github.com/breck7/pldb/blob/main/database/grammar/leachim6.grammar#L1
63,githubBigQuery.users,421,9%,1,,,,githubBigQuery.grammar,https://github.com/breck7/pldb/blob/main/database/grammar/githubBigQuery.grammar#L9
64,githubBigQuery,421,9%,1C Enterprise,Google BigQuery Public Datasets has a dataset with info on GitHub repos: https://cloud.google.com/blog/topics/public-datasets/github-on-bigquery-analyze-all-the-open-source-code,cloud.google.com,https://cloud.google.com,githubBigQuery.grammar,https://github.com/breck7/pldb/blob/main/database/grammar/githubBigQuery.grammar#L1
65,linguistGrammarRepo,416,9%,https://github.com/textmate/c.tmbundle,"Linguist is a library used by GitHub to syntax highlight files on GitHub via a grammar. The list of languages supported by Linguist and the grammar package used for each language is listed here: https://github.com/github/linguist/blob/master/vendor/README.md. If Linguist has support for a language, it will have a repo on GitHub. Given a language is supported by Linguist, that is a good indication it has at least 200 unique :user/:repo repositories, according to their docs.",github.com,https://github.com,linguistGrammarRepo.grammar,https://github.com/breck7/pldb/blob/main/database/grammar/linguistGrammarRepo.grammar#L1
66,linguistGrammarRepo.commitCount,398,8%,40,How many commits in this repo?,,,linguistGrammarRepo.grammar,https://github.com/breck7/pldb/blob/main/database/grammar/linguistGrammarRepo.grammar#L12
67,linguistGrammarRepo.committerCount,398,8%,2,How many people have made commits in this repo?,,,linguistGrammarRepo.grammar,https://github.com/breck7/pldb/blob/main/database/grammar/linguistGrammarRepo.grammar#L28
68,linguistGrammarRepo.lastCommit,398,8%,2018,What year was the last commit made?,,,linguistGrammarRepo.grammar,https://github.com/breck7/pldb/blob/main/database/grammar/linguistGrammarRepo.grammar#L20
69,linguistGrammarRepo.firstCommit,398,8%,2013,What year was the first commit made?,,,linguistGrammarRepo.grammar,https://github.com/breck7/pldb/blob/main/database/grammar/linguistGrammarRepo.grammar#L16
70,wordRank,378,8%,5584,"Some creators use a common English word as their language's name. For these we note how common the word is, where ""the"" is 1.",,,name.grammar,https://github.com/breck7/pldb/blob/main/database/grammar/name.grammar#L8
71,leachim6.fileExtensions,368,8%,m,"An Array of associated extensions (the first one is considered the primary extension, the others should be listed alphabetically).",,,githubLanguage.grammar,https://github.com/breck7/pldb/blob/main/database/grammar/githubLanguage.grammar#L14
72,linguistGrammarRepo.sampleCount,365,8%,1,How many language samples in this repo?,,,linguistGrammarRepo.grammar,https://github.com/breck7/pldb/blob/main/database/grammar/linguistGrammarRepo.grammar#L24
73,features.hasStrings,352,7%,true,,,,features.grammar,https://github.com/breck7/pldb/blob/main/database/grammar/features.grammar#L397
74,pygmentsHighlighter.filename,340,7%,templates.py,,,,pygments.grammar,https://github.com/breck7/pldb/blob/main/database/grammar/pygments.grammar#L7
75,pygmentsHighlighter,340,7%,ABAP,A link to a Pygments syntax highlighting class for this language (https://pygments.org/),pygments.org,https://pygments.org,pygments.grammar,https://github.com/breck7/pldb/blob/main/database/grammar/pygments.grammar#L1
76,stringToken,331,7%,"""",What token(s) is used to delimite a string?,,,featureTokens.grammar,https://github.com/breck7/pldb/blob/main/database/grammar/featureTokens.grammar#L34
77,rosettaCode,330,7%,ABAP,A link to this language on Rosetta Code - http://www.rosettacode.org/,rosettacode.org,https://rosettacode.org,rosettaCode.grammar,https://github.com/breck7/pldb/blob/main/database/grammar/rosettaCode.grammar#L1
78,pygmentsHighlighter.fileExtensions,325,7%,j,"An Array of associated extensions (the first one is considered the primary extension, the others should be listed alphabetically).",,,githubLanguage.grammar,https://github.com/breck7/pldb/blob/main/database/grammar/githubLanguage.grammar#L14
79,standsFor,317,7%,3D Manufacturing Format,"If the language name is an abbreviation, what does/did it stand for?",,,name.grammar,https://github.com/breck7/pldb/blob/main/database/grammar/name.grammar#L13
80,printToken,313,7%,print,What token(s) is used to print a message?,,,featureTokens.grammar,https://github.com/breck7/pldb/blob/main/database/grammar/featureTokens.grammar#L28
81,features.hasPrintDebugging,311,7%,true,,,,features.grammar,https://github.com/breck7/pldb/blob/main/database/grammar/features.grammar#L352
82,twitter,240,5%,https://twitter.com/docker,"Official Twitter handle of the entity, if any.",twitter.com,https://twitter.com,twitter.grammar,https://github.com/breck7/pldb/blob/main/database/grammar/twitter.grammar#L1
83,features.hasMultiLineComments,233,5%,true,,,,features.grammar,https://github.com/breck7/pldb/blob/main/database/grammar/features.grammar#L158
84,rijuRepl,222,5%,https://riju.codes/abc,A link to try this language on riju.codes,riju.codes,https://riju.codes,rijuRepl.grammar,https://github.com/breck7/pldb/blob/main/database/grammar/rijuRepl.grammar#L1
85,githubLanguage.codemirror_mime_type,216,5%,text/x-csrc,A String name of the file mime type used for highlighting whenever a file is edited. This should match the `mime` associated with the mode from https://git.io/f4SoQ,,,githubLanguage.grammar,https://github.com/breck7/pldb/blob/main/database/grammar/githubLanguage.grammar#L26
86,githubLanguage.codemirror_mode,216,5%,clike,A String name of the CodeMirror Mode used for highlighting whenever a file is edited. This must match a mode from https://git.io/vi9Fx,,,githubLanguage.grammar,https://github.com/breck7/pldb/blob/main/database/grammar/githubLanguage.grammar#L22
87,tiobe,204,4%,CIL,Tiobe maintains a well known ranking of programming languages here: https://www.tiobe.com/tiobe-index/,tiobe.com,https://tiobe.com,tiobe.grammar,https://github.com/breck7/pldb/blob/main/database/grammar/tiobe.grammar#L1
88,multiLineCommentTokens,171,4%,/* */,A comment with a start delimiter and end token (which can be the same) that can span multiple lines.,,,featureTokens.grammar,https://github.com/breck7/pldb/blob/main/database/grammar/featureTokens.grammar#L22
89,fileExtensions,160,3%,n,"An Array of associated extensions (the first one is considered the primary extension, the others should be listed alphabetically).",,,githubLanguage.grammar,https://github.com/breck7/pldb/blob/main/database/grammar/githubLanguage.grammar#L14
90,related,157,3%,dot,"What languages are related? This serves as a catch all, and it is better to use a more specific relationship node such as ""supersetOf"".",,,relationships.grammar,https://github.com/breck7/pldb/blob/main/database/grammar/relationships.grammar#L4
91,aka,155,3%,BRL,Another name for the language. Entries can have multiple aka lines.,,,name.grammar,https://github.com/breck7/pldb/blob/main/database/grammar/name.grammar#L18
92,helloWorldCollection,149,3%,A Programming Language,Hello world written in this language from http://helloworldcollection.de/,helloworldcollection.de,https://helloworldcollection.de,helloWorldCollection.grammar,https://github.com/breck7/pldb/blob/main/database/grammar/helloWorldCollection.grammar#L1
93,features.hasIntegers,148,3%,true,,,,features.grammar,https://github.com/breck7/pldb/blob/main/database/grammar/features.grammar#L256
94,githubLanguage.aliases,142,3%,AFDKO,An Array of additional aliases (implicitly includes name.downcase).,,,githubLanguage.grammar,https://github.com/breck7/pldb/blob/main/database/grammar/githubLanguage.grammar#L45
95,tryItOnline,128,3%,perl6,A link to try this language on https://tio.run,tio.run,https://tio.run,tryItOnline.grammar,https://github.com/breck7/pldb/blob/main/database/grammar/tryItOnline.grammar#L1
96,features.hasFloats,128,3%,true,,,,features.grammar,https://github.com/breck7/pldb/blob/main/database/grammar/features.grammar#L204
97,featureKeyword,119,3%,canDoShebang,Links a feature entry to the related feature keyword in the pldb grammar.,,,features.grammar,https://github.com/breck7/pldb/blob/main/database/grammar/features.grammar#L12
98,pseudoExample,119,3%,# Hello PLDB,As short an example as possible.,,,features.grammar,https://github.com/breck7/pldb/blob/main/database/grammar/features.grammar#L1
99,features.hasBooleans,108,2%,true,,,,features.grammar,https://github.com/breck7/pldb/blob/main/database/grammar/features.grammar#L135
100,wikipedia.fileExtensions,106,2%,n,"An Array of associated extensions (the first one is considered the primary extension, the others should be listed alphabetically).",,,githubLanguage.grammar,https://github.com/breck7/pldb/blob/main/database/grammar/githubLanguage.grammar#L14
101,projectEuler.memberCount.2022,105,2%,11,,,,primitives.grammar,https://github.com/breck7/pldb/blob/main/database/grammar/primitives.grammar#L86
102,projectEuler,105,2%,APL/J/K,Is this language one of the ones listed on https://projecteuler.net/?,projecteuler.net,https://projecteuler.net,projectEuler.grammar,https://github.com/breck7/pldb/blob/main/database/grammar/projectEuler.grammar#L1
103,features.hasHexadecimals,102,2%,true,,,,features.grammar,https://github.com/breck7/pldb/blob/main/database/grammar/features.grammar#L260
104,booleanTokens,97,2%,true false,What token(s) is used for true and false?,,,featureTokens.grammar,https://github.com/breck7/pldb/blob/main/database/grammar/featureTokens.grammar#L46
105,keywords,93,2%,"! ' '' - -< -<< -> :: ; <- , = => > ? # \* @ [|, |] \ \_ ` {, } {-, -} | ~ as case of class data family instance default deriving do forall foreign hiding if then else import infix infixl infixr let in mdo module newtype proc qualified rec type where",What are all the keywords in this language?,,,featureTokens.grammar,https://github.com/breck7/pldb/blob/main/database/grammar/featureTokens.grammar#L1
106,visualParadigm,91,2%,false,"Is this a visual programming thing? Sometimes called ""no code"" or ""low code""?",,,paradigms.grammar,https://github.com/breck7/pldb/blob/main/database/grammar/paradigms.grammar#L5
107,domainName.awisRank.2017,87,2%,102718,,,,primitives.grammar,https://github.com/breck7/pldb/blob/main/database/grammar/primitives.grammar#L83
108,projectEuler.memberCount.2019,87,2%,9,,,,primitives.grammar,https://github.com/breck7/pldb/blob/main/database/grammar/primitives.grammar#L86
109,codeMirror,80,2%,apl,A link to a CodeMirror syntax highlighting package for this language (https://github.com/codemirror/codemirror5/tree/master/mode/LANGUAGE),codemirror.net,https://codemirror.net,codemirror.grammar,https://github.com/breck7/pldb/blob/main/database/grammar/codemirror.grammar#L1
110,monaco,74,2%,cpp,A link to a Monaco syntax highlighting package for this language.,microsoft.github.io/monaco-editor/,https://microsoft.github.io/monaco-editor/,monaco.grammar,https://github.com/breck7/pldb/blob/main/database/grammar/monaco.grammar#L1
111,jupyterKernel,73,2%,http://coconut-lang.org/,A link to a Jupyter Kernel for this language.,jupyter.org,https://jupyter.org,jupyter.grammar,https://github.com/breck7/pldb/blob/main/database/grammar/jupyter.grammar#L1
112,subreddit,73,2%,https://reddit.com/r/C_Programming,Url of a subreddit(s) for this language.,reddit.com,https://reddit.com,reddit.grammar,https://github.com/breck7/pldb/blob/main/database/grammar/reddit.grammar#L1
113,subreddit.memberCount.2022,72,2%,202070,,,,primitives.grammar,https://github.com/breck7/pldb/blob/main/database/grammar/primitives.grammar#L86
114,githubLanguage.interpreters,71,2%,lua,An Array of associated interpreters,,,githubLanguage.grammar,https://github.com/breck7/pldb/blob/main/database/grammar/githubLanguage.grammar#L41
115,quineRelay,71,2%,Ada,The Quine Relay project (https://github.com/mame/quine-relay).,github.com/mame/quine-relay,https://github.com/mame/quine-relay,quineRelay.grammar,https://github.com/breck7/pldb/blob/main/database/grammar/quineRelay.grammar#L1
116,features.hasConditionals,67,1%,true,,,,features.grammar,https://github.com/breck7/pldb/blob/main/database/grammar/features.grammar#L151
117,writtenIn,66,1%,cpp,What language is this application written in?,,,relationships.grammar,https://github.com/breck7/pldb/blob/main/database/grammar/relationships.grammar#L26
118,webRepl,66,1%,https://play.rust-lang.org/,An online repl for the project.,,,website.grammar,https://github.com/breck7/pldb/blob/main/database/grammar/website.grammar#L6
119,ubuntuPackage,65,1%,aspectj,The name of an Ubuntu package for the language from https://packages.ubuntu.com/.,ubuntu.com,https://ubuntu.com,ubuntu.grammar,https://github.com/breck7/pldb/blob/main/database/grammar/ubuntu.grammar#L1
120,antlr,60,1%,https://github.com/afucher/yaip,A link to the ANTLR grammar for this language (https://github.com/antlr/grammars-v4/tree/master/LANGUAGE),antlr.org,https://antlr.org,antlr.grammar,https://github.com/breck7/pldb/blob/main/database/grammar/antlr.grammar#L1
121,meetup.groupCount,57,1%,11,,,,meetup.grammar,https://github.com/breck7/pldb/blob/main/database/grammar/meetup.grammar#L11
122,meetup.memberCount,57,1%,69338,,,,meetup.grammar,https://github.com/breck7/pldb/blob/main/database/grammar/meetup.grammar#L7
123,meetup,57,1%,c,Some languages have active meetup groups on Meetup.com ,meetup.com,https://meetup.com,meetup.grammar,https://github.com/breck7/pldb/blob/main/database/grammar/meetup.grammar#L1
124,linkedInSkill.2018,57,1%,1021,,,,primitives.grammar,https://github.com/breck7/pldb/blob/main/database/grammar/primitives.grammar#L86
125,linkedInSkill,57,1%,MongoDB,How many people list this skill on LinkedIn?,linkedin.com,https://linkedin.com,linkedInSkill.grammar,https://github.com/breck7/pldb/blob/main/database/grammar/linkedInSkill.grammar#L1
126,packageRepository,54,1%,https://www.nuget.org/,URL to the package repository for this language.,,,packages.grammar,https://github.com/breck7/pldb/blob/main/database/grammar/packages.grammar#L1
